{
  "$schema": "https://json-schema.org/draft/2020-12/schema",
  "$id": "https://gimle.dev/contracts/build-system/bazel-query-aquery-v1.schema.json",
  "title": "Bazel query + aquery v1 sample",
  "type": "object",
  "required": [
    "schema_version",
    "tool_name",
    "tool_version",
    "workspace_root",
    "capture_mode",
    "query",
    "aquery"
  ],
  "properties": {
    "schema_version": {
      "const": "bazel-query-aquery-v1"
    },
    "tool_name": {
      "const": "bazel"
    },
    "tool_version": {
      "type": "string",
      "minLength": 1,
      "maxLength": 128
    },
    "workspace_root": {
      "type": "string",
      "minLength": 1,
      "maxLength": 256
    },
    "capture_mode": {
      "type": "string",
      "enum": [
        "live_bazel",
        "committed_sample_no_local_bazel"
      ]
    },
    "query": {
      "type": "object",
      "required": [
        "labels"
      ],
      "properties": {
        "labels": {
          "type": "array",
          "minItems": 1,
          "maxItems": 128,
          "items": {
            "type": "string",
            "minLength": 1,
            "maxLength": 128
          }
        }
      }
    },
    "aquery": {
      "type": "object",
      "required": [
        "actions"
      ],
      "properties": {
        "actions": {
          "type": "array",
          "minItems": 1,
          "maxItems": 64,
          "items": {
            "type": "object",
            "required": [
              "target_label",
              "mnemonic",
              "commandline_redacted",
              "inputs_sample",
              "outputs_sample"
            ],
            "properties": {
              "target_label": {
                "type": "string",
                "minLength": 1,
                "maxLength": 128
              },
              "mnemonic": {
                "type": "string",
                "minLength": 1,
                "maxLength": 64
              },
              "commandline_redacted": {
                "type": "boolean",
                "const": true
              },
              "inputs_sample": {
                "type": "array",
                "maxItems": 16,
                "items": {
                  "type": "string",
                  "maxLength": 256
                }
              },
              "outputs_sample": {
                "type": "array",
                "maxItems": 16,
                "items": {
                  "type": "string",
                  "maxLength": 256
                }
              }
            }
          }
        }
      }
    }
  }
}
